{
  "id": "UC4QobU6STFB0P71PMvOGN5A",
  "channel": "jawed",
  "channel_id": "UC4QobU6STFB0P71PMvOGN5A",
  "title": "jawed - Videos",
  "availability": null,
  "channel_follower_count": 5720000,
  "description": "",
  "tags": [
    "me at the zoo",
    "jawed karim",
    "first youtube video"
  ],
  "thumbnails": [
    {
      "url": "https://yt3.googleusercontent.com/uI3VE4PVqvCy0xnWLqMJnEzyBUm3T8VHOCp4ee-1RxdHqKXCdUE_qXYQnpf9AfuEoIPactVyDhM=s900-c-k-c0x00ffffff-no-rj",
      "height": 900,
      "width": 900
    },
    {
      "url": "https://yt3.googleusercontent.com/uI3VE4PVqvCy0xnWLqMJnEzyBUm3T8VHOCp4ee-1RxdHqKXCdUE_qXYQnpf9AfuEoIPactVyDhM=s0",
      "id": "avatar_uncropped",
      "preference": 1
    },
    {
      "url": "https://yt3.googleusercontent.com/9oxdo7zGCuEofTfnBIuUAf7B0ynncs-aQmgx9lXQ33VRwrJyQlHmYpH6wfczKgGYfVThQ31dhg=w1060-fcrop64=1,00005a57ffffa5a8-k-c0xffffffff-no-nd-rj",
      "height": 175,
      "width": 1060,
      "preference": -10
    },
    {
      "url": "https://yt3.googleusercontent.com/9oxdo7zGCuEofTfnBIuUAf7B0ynncs-aQmgx9lXQ33VRwrJyQlHmYpH6wfczKgGYfVThQ31dhg=w1138-fcrop64=1,00005a57ffffa5a8-k-c0xffffffff-no-nd-rj",
      "height": 188,
      "width": 1138,
      "preference": -10
    },
    {
      "url": "https://yt3.googleusercontent.com/9oxdo7zGCuEofTfnBIuUAf7B0ynncs-aQmgx9lXQ33VRwrJyQlHmYpH6wfczKgGYfVThQ31dhg=w1707-fcrop64=1,00005a57ffffa5a8-k-c0xffffffff-no-nd-rj",
      "height": 283,
      "width": 1707,
      "preference": -10
    },
    {
      "url": "https://yt3.googleusercontent.com/9oxdo7zGCuEofTfnBIuUAf7B0ynncs-aQmgx9lXQ33VRwrJyQlHmYpH6wfczKgGYfVThQ31dhg=w2120-fcrop64=1,00005a57ffffa5a8-k-c0xffffffff-no-nd-rj",
      "height": 351,
      "width": 2120,
      "preference": -10
    },
    {
      "url": "https://yt3.googleusercontent.com/9oxdo7zGCuEofTfnBIuUAf7B0ynncs-aQmgx9lXQ33VRwrJyQlHmYpH6wfczKgGYfVThQ31dhg=w2276-fcrop64=1,00005a57ffffa5a8-k-c0xffffffff-no-nd-rj",
      "height": 377,
      "width": 2276,
      "preference": -10
    },
    {
      "url": "https://yt3.googleusercontent.com/9oxdo7zGCuEofTfnBIuUAf7B0ynncs-aQmgx9lXQ33VRwrJyQlHmYpH6wfczKgGYfVThQ31dhg=w2560-fcrop64=1,00005a57ffffa5a8-k-c0xffffffff-no-nd-rj",
      "height": 424,
      "width": 2560,
      "preference": -10
    },
    {
      "url": "https://yt3.googleusercontent.com/9oxdo7zGCuEofTfnBIuUAf7B0ynncs-aQmgx9lXQ33VRwrJyQlHmYpH6wfczKgGYfVThQ31dhg=s0",
      "id": "banner_uncropped",
      "preference": -5
    }
  ],
  "uploader_id": "@jawed",
  "uploader_url": "https://www.youtube.com/@jawed",
  "modified_date": null,
  "view_count": null,
  "playlist_count": null,
  "uploader": "jawed",
  "channel_url": "https://www.youtube.com/channel/UC4QobU6STFB0P71PMvOGN5A",
  "_type": "playlist",
  "entries": "<generator object YoutubeTabBaseInfoExtractor._entries at 0x000002290C3472E0>",
  "extractor_key": "YoutubeTab",
  "extractor": "youtube:tab",
  "webpage_url": "https://www.youtube.com/jawed/videos",
  "original_url": "https://www.youtube.com/jawed",
  "webpage_url_basename": "videos",
  "webpage_url_domain": "youtube.com",
  "epoch": 1758977383,
  "_version": {
    "version": "2025.09.26",
    "current_git_head": null,
    "release_git_head": "12b57d2858845c0c7fb33bf9aa8ed7be6905535d",
    "repository": "yt-dlp/yt-dlp"
  }
}
